{
  "schemaVersion": "candlescope.python-first-release/2",
  "baseSha": "5df19ae76686977f324644e9e62a63b73cf6a743",
  "gitSha": "3e00e08a5d705854d2a15cdb2c0a4aca877b88ff",
  "gitDirty": false,
  "branch": "codex/backtest-foundation",
  "status": "VALIDATED_CLEAN_SHA_UNMERGED",
  "merged": false,
  "pushed": false,
  "productionEnabled": false,
  "pythonIdentities": {
    "authorContract": "candlescope.python-strategy/1",
    "providerProtocol": "strategy-provider/1",
    "bundleSchema": "candlescope.python-strategy-bundle/1",
    "runtimeProfile": "python-strategy-runtime/1",
    "wireTransport": "strict-jsonl/1"
  },
  "effectiveFlags": {
    "BACKTEST_ENABLED": "0",
    "BACKTEST_BAR_ENABLED": "0",
    "BACKTEST_TRADE_TAPE_ENABLED": "0",
    "BACKTEST_STUDY_ENABLED": "0",
    "BACKTEST_REPLAY_REVIEW_BRIDGE_ENABLED": "0",
    "BACKTEST_EXTERNAL_PROVIDER_ENABLED": "0",
    "BACKTEST_BOOK_ASSISTED_ENABLED": "0",
    "BACKTEST_MULTI_MARKET_ENABLED": "0",
    "BACKTEST_ONLINE_LEARNING_ENABLED": "0",
    "BACKTEST_PYTHON_STRATEGY_ENABLED": "0",
    "BACKTEST_PYTHON_TRUSTED_LOCAL_ENABLED": "0",
    "BACKTEST_PYTHON_SCALE_V1_ENABLED": "0",
    "VITE_BACKTEST_ENTRY_ENABLED": "0",
    "VITE_BACKTEST_PYTHON_STRATEGY_ENABLED": "0",
    "VITE_BACKTEST_PYTHON_TRUSTED_LOCAL_ENABLED": "0"
  },
  "datasetSnapshotHashes": [
    "sha256:77e2b852e645aa4812a2a45b7e937fa65973cd03e2aed125c8b02de797b9b743",
    "sha256:bb92a8a576bb5a9a28870715526717ac76e5cfa92177abeddba48f23c19005bf"
  ],
  "hashes": {
    "decision": "cfb9445ee26aebfd1bfb791807171144943884d0ceeb51661157051ab9ccf0c6",
    "fill": "8794741d7f91cf3b92eeb15b8a1bea254411394b3f83c1f83ac8157d85752a2e",
    "ledger": null,
    "report": "sha256:396a602e2165bd37cb54090fe496aedb34f782f890b188b7c276ddb8a6de7b09"
  },
  "artifactPaths": [
    {
      "kind": "n10-gate-module",
      "path": "backend/app/backtest/python_first_n10.py",
      "sha256": "840e187921eed689cf08655edf66f3e2f5e8f64417eed15473d0e0bce6670240"
    },
    {
      "kind": "n10-lifecycle",
      "path": "backend/app/backtest/python_first_lifecycle.py",
      "sha256": "2f97a943cb9aa8db04410de7e5d30ddd05c82e5c8b22e6ef2eab621bc48aa012"
    },
    {
      "kind": "n10-verifier",
      "path": "backend/scripts/verify_backtest_python_first_n10.py",
      "sha256": "ac9f442c23e969c112b7320c64c70ce9ebbb333aeca0beda68454dd6bad39431"
    },
    {
      "kind": "n10-soak-script",
      "path": "backend/scripts/soak_python_first_n10.py",
      "sha256": "e891bc8f9b68b952c2b0fa714fbd5ef7a9bb49f93bd14bf31c457429a5fdddd7"
    },
    {
      "kind": "n10-schema",
      "path": "docs/perf-baselines/backtest/python-first-n10-release.schema.json",
      "sha256": "65faafb9ad6c43911272ee1b95a9798e4423a46642d8b117efc2a8f2ceb9191d"
    },
    {
      "kind": "n8-1m-bar",
      "path": "docs/evidence/backtest-python-first-n8-1m-bar-20260815.json",
      "sha256": "dfe69eb0aa08c17ace68d5f1f82546c55408c4e7f72741da8ebfc3a300091ac2"
    },
    {
      "kind": "n10-4h-browser-soak",
      "path": "docs/evidence/backtest-python-first-n10-4h-soak-20260815.json",
      "sha256": "00417e94dd6422c289a2bfc618bea7122981b44166164064390dad9f3a2b6d58"
    }
  ],
  "gates": {
    "repositoryRegression": "PASS",
    "pythonSecurityBoundary": "PASS",
    "browserAcceptance": "PASS",
    "performanceSoak": "PASS",
    "disabledBoot": "PASS",
    "defaultProductionFlagsOff": "PASS",
    "publicApiSmoke": "PASS",
    "checkpointFaultInjection": "PASS",
    "exactRevertDetachedWorktree": "PASS",
    "releaseManifestSha256": "PASS"
  },
  "knownLimitations": [
    "Pine/Pyne remain restricted compatibility subsets and are outside this Python-first closeout",
    "BAR_APPROX is approximate; aggTrade is not raw trade or queue exact",
    "BACKTEST_MULTI_MARKET_ENABLED stays 0; basket is independent per-symbol only",
    "backtest outputs cannot directly trigger paper or live orders"
  ],
  "commands": [
    {
      "command": "python -m pytest -q backend --tb=short",
      "exitCode": 0,
      "durationSeconds": 1860.06
    },
    {
      "command": "npm run check",
      "exitCode": 0,
      "durationSeconds": 229.0
    },
    {
      "command": "python backend/scripts/soak_python_first_n10.py --duration-ms 3600000 --cycles 100000",
      "exitCode": 0,
      "durationSeconds": 3600.125
    },
    {
      "command": "node frontend/scripts/backtest-python-n10-browser-soak.mjs --duration-ms 14400000 --port 15184",
      "exitCode": 0,
      "durationSeconds": 14400.015
    },
    {
      "command": "python -m pytest -q packages/candlescope-backtest-sdk/tests",
      "exitCode": 0,
      "durationSeconds": 16.56
    },
    {
      "command": "cargo test --offline --manifest-path examples/plugins/aho-corasick-adapter/Cargo.toml",
      "exitCode": 0,
      "durationSeconds": 2.43
    },
    {
      "command": "detached exact revert 52c108c1..3e00e08a and 15-test rollback health set",
      "exitCode": 0,
      "durationSeconds": 13.89
    }
  ]
}
